<?xml version="1.0" encoding="UTF-8"?>
<!--

    Copyright 2015-2025 Open Text.

    Licensed under the Apache License, Version 2.0 (the "License");
    you may not use this file except in compliance with the License.
    You may obtain a copy of the License at

         http://www.apache.org/licenses/LICENSE-2.0

    Unless required by applicable law or agreed to in writing, software
    distributed under the License is distributed on an "AS IS" BASIS,
    WITHOUT WARRANTIES OR CONDITIONS OF ANY KIND, either express or implied.
    See the License for the specific language governing permissions and
    limitations under the License.

-->
<AuditedApplication			
    xmlns:xsi="http://www.w3.org/2001/XMLSchema-instance"
    xmlns="https://cafaudit.github.io/audit-service/schema/AuditedApplication.xsd" 
    xsi:schemaLocation="https://cafaudit.github.io/audit-service/schema/AuditedApplication.xsd"			
>
	<ApplicationId>ProductX</ApplicationId>
	<AuditEvents>
	  <AuditEvent>
		<TypeId>viewDocument</TypeId>
		<UnexpectedElement>This is here for unit test purposes.</UnexpectedElement>
		<Params>
		  <Param>
			<Name>docId</Name>
			<Type>long</Type>
			<Description>Identifies the document that was viewed</Description>
		  </Param>
		</Params>
	  </AuditEvent>
	  <AuditEvent>
		<TypeId>policyApplied</TypeId>
		<UnexpectedElement>This is here for unit test purposes.</UnexpectedElement>
		<Params>
		  <Param>
			<Name>PolicyId</Name>
			<Type>long</Type>
			<Description>Identifies the policy being applied</Description>
		  </Param>
		  <Param>
			<Name>policyName</Name>
			<Type>string</Type>
			<Description>The name of the policy being applied</Description>
		  </Param>
		  <Param>
			<Name>policyDef</Name>
			<Type>string</Type>
			<Description>The definition of the policy being applied</Description>
		  </Param>
		</Params>
	  </AuditEvent>	  
	</AuditEvents>
</AuditedApplication>
