<?xml version="1.0" encoding="UTF-8"?>
<!--

    Copyright 2015-2017 Hewlett Packard Enterprise Development LP.

    Licensed under the Apache License, Version 2.0 (the "License");
    you may not use this file except in compliance with the License.
    You may obtain a copy of the License at

         http://www.apache.org/licenses/LICENSE-2.0

    Unless required by applicable law or agreed to in writing, software
    distributed under the License is distributed on an "AS IS" BASIS,
    WITHOUT WARRANTIES OR CONDITIONS OF ANY KIND, either express or implied.
    See the License for the specific language governing permissions and
    limitations under the License.

-->
<AuditedApplication
        xmlns:xsi="http://www.w3.org/2001/XMLSchema-instance"
        xmlns="http://www.hpe.com/CAF/Auditing/Schema/AuditedApplication.xsd"
        xsi:schemaLocation="http://www.hpe.com/CAF/Auditing/Schema/AuditedApplication.xsd"
>
<ApplicationId>CAFStorageService</ApplicationId>
    <AuditEvents>
        <AuditEvent>
            <TypeId>apiRequest</TypeId>
            <CategoryId>apiEvents</CategoryId>
            <Params>
                <Param>
                    <Name>realmId</Name>
                    <Type>string</Type>
                    <Constraints>
                        <MinLength>1</MinLength>
                        <MaxLength>32</MaxLength>
                    </Constraints>
                    <Description>Realm identifier</Description>
                </Param>
                <Param>
                    <Name>containerId</Name>
                    <Type>string</Type>
                    <Constraints>
                        <MaxLength>32</MaxLength>
                    </Constraints>
                    <Description>Asset Container identifier</Description>
                </Param>
                <Param>
                    <Name>assetId</Name>
                    <Type>string</Type>
                    <Constraints>
                        <MinLength></MinLength>
                        <MaxLength></MaxLength>
                    </Constraints>
                    <Description>Asset identifier</Description>
                </Param>
                <Param>
                    <Name>revId</Name>
                    <Type>string</Type>
                    <Description>Asset Revision identifier</Description>
                </Param>
                <Param>
                    <Name>requestId</Name>
                    <Type>string</Type>
                    <Description>Request identifier</Description>
                </Param>
                <Param>
                    <Name>requestType</Name>
                    <Type>int</Type>
                    <Description>Request type</Description>
                </Param>
                <Param>
                    <Name>requestUri</Name>
                    <Type>string</Type>
                    <Description>Request URI</Description>
                </Param>
            </Params>
        </AuditEvent>
        <AuditEvent>
            <TypeId>apiResponse</TypeId>
            <CategoryId>apiEvents</CategoryId>
            <Params>
                <Param>
                    <Name>realmId</Name>
                    <Type>string</Type>
                    <Constraints>
                        <MinLength>1</MinLength>
                    </Constraints>
                    <Description>Realm identifier</Description>
                </Param>
                <Param>
                    <Name>requestId</Name>
                    <Type>string</Type>
                    <Constraints>
                        <MaxLength>32</MaxLength>
                    </Constraints>
                    <Description>Request identifier</Description>
                </Param>
                <Param>
                    <Name>statusCode</Name>
                    <Type>int</Type>
                    <Description>Request status code</Description>
                </Param>
                <Param>
                    <Name>errorMessage</Name>
                    <Type>string</Type>
                    <Constraints>
                        <MaxLength>32000000</MaxLength>
                    </Constraints>
                    <Description>Error message, if applicable</Description>
                </Param>
            </Params>
        </AuditEvent>
        <AuditEvent>
            <TypeId>blockPurged</TypeId>
            <CategoryId>internalEvents</CategoryId>
            <Params>
                <Param>
                    <Name>realmId</Name>
                    <Type>string</Type>
                    <Constraints>
                        <MaxLength>32</MaxLength>
                    </Constraints>
                    <Description>Realm identifier</Description>
                </Param>
                <Param>
                    <Name>rawSignature</Name>
                    <Type>string</Type>
                    <Constraints>
                        <MinLength></MinLength>
                        <MaxLength></MaxLength>
                    </Constraints>
                    <Description>Raw block signature</Description >
                </Param>
                <Param>
                    <Name>referenceLocation</Name>
                    <Type>string</Type>
                    <Constraints>
                        <MinLength></MinLength>
                        <MaxLength></MaxLength>
                    </Constraints>
                    <Description>Reference location for stored block</Description >
                </Param>
                <Param>
                    <Name>storageDeviceId</Name>
                    <Type>long</Type>
                    <Description>Storage device identifier</Description >
                </Param>
            </Params>
        </AuditEvent>
    </AuditEvents>
</AuditedApplication>
