<?xml version="1.0" encoding="UTF-8"?>
<!--

    Copyright 2015-2017 Hewlett Packard Enterprise Development LP.

    Licensed under the Apache License, Version 2.0 (the "License");
    you may not use this file except in compliance with the License.
    You may obtain a copy of the License at

         http://www.apache.org/licenses/LICENSE-2.0

    Unless required by applicable law or agreed to in writing, software
    distributed under the License is distributed on an "AS IS" BASIS,
    WITHOUT WARRANTIES OR CONDITIONS OF ANY KIND, either express or implied.
    See the License for the specific language governing permissions and
    limitations under the License.

-->
<AuditedApplication
		xmlns:xsi="http://www.w3.org/2001/XMLSchema-instance"
		xmlns="http://www.hpe.com/CAF/Auditing/Schema/AuditedApplication.xsd"
		xsi:schemaLocation="http://www.hpe.com/CAF/Auditing/Schema/AuditedApplication.xsd"
>
	<ApplicationId>ApplicationX</ApplicationId>
	<AuditEvents>
		<AuditEvent>
			<TypeId>viewDocument</TypeId>
			<CategoryId>documentEvents</CategoryId>
			<Params>
				<Param>
					<Name>String_Param</Name>
					<Type>string</Type>
					<ColumnName>String_Param</ColumnName>
					<Description>Description for String_Param</Description>
				</Param>
				<Param>
					<Name>Int16_Param</Name>
					<Type>short</Type>
					<ColumnName>Int16_Param</ColumnName>
					<Description>Description for Int16_Param</Description>
				</Param>
				<Param>
					<Name>Int32_Param</Name>
					<Type>int</Type>
					<ColumnName>Int32_Param</ColumnName>
					<Description>Description for Int32_Param</Description>
				</Param>
				<Param>
					<Name>Int64_Param</Name>
					<Type>long</Type>
					<ColumnName>Int64_Param</ColumnName>
					<Description>Description for Int64_Param</Description>
				</Param>
				<Param>
					<Name>Float_Param</Name>
					<Type>float</Type>
					<ColumnName>Float_Param</ColumnName>
					<Description>Description for Float_Param</Description>
				</Param>
				<Param>
					<Name>Double_Param</Name>
					<Type>double</Type>
					<ColumnName>Double_Param</ColumnName>
					<Description>Description for Double_Param</Description>
				</Param>
				<Param>
					<Name>Boolean_Param</Name>
					<Type>boolean</Type>
					<ColumnName>Boolean_Param</ColumnName>
					<Description>Description for Boolean_Param</Description>
				</Param>
				<Param>
					<Name>Date_Param</Name>
					<Type>date</Type>
					<ColumnName>Date_Param</ColumnName>
					<Description>Description for Date_Param</Description>
				</Param>
			</Params>
		</AuditEvent>
		<AuditEvent>
			<TypeId>viewDocument2</TypeId>
			<CategoryId>documentEvents2</CategoryId>
			<Params>
				<Param>
					<Name>String_Param2</Name>
					<Type>string</Type>
					<Constraints>
						<MaxLength>1000000</MaxLength>
					</Constraints>
					<ColumnName>String_Param2</ColumnName>
					<Description>Description for String_Param2</Description>
				</Param>
				<Param>
					<Name>Int16_Param2</Name>
					<Type>short</Type>
					<ColumnName>Int16_Param2</ColumnName>
					<Description>Description for Int16_Param2</Description>
				</Param>
			</Params>
		</AuditEvent>
		<AuditEvent>
			<TypeId>viewDocument3</TypeId>
			<CategoryId>documentEvents3</CategoryId>
			<Params>
				<Param>
					<Name>String_Param2</Name>
					<Type>string</Type>
					<Constraints>
						<MaxLength>32000000</MaxLength>
					</Constraints>
					<ColumnName>String_Param2</ColumnName>
					<Description>Description for String_Param2</Description>
				</Param>
			</Params>
		</AuditEvent>
	</AuditEvents>
</AuditedApplication>
