<?xml version="1.0" encoding="UTF-8"?>
<AuditedApplication
		xmlns:xsi="http://www.w3.org/2001/XMLSchema-instance"
		xmlns="http://www.hpe.com/CAF/Auditing/Schema/AuditedApplication.xsd"
		xsi:schemaLocation="http://www.hpe.com/CAF/Auditing/Schema/AuditedApplication.xsd"
>
	<ApplicationId>TestApplication</ApplicationId>
	<AuditEvents>
		<AuditEvent>
			<TypeId>TestEvent1</TypeId>
			<CategoryId>TestCategory1</CategoryId>
			<Params>
				<Param>
					<Name>StringType</Name>
					<Type>string</Type>
					<ColumnName>StringType</ColumnName>
					<Description>Description for StringType</Description>
				</Param>
				<Param>
					<Name>Int16Type</Name>
					<Type>short</Type>
					<ColumnName>Int16Type</ColumnName>
					<Description>Description for Int16Type</Description>
				</Param>
				<Param>
					<Name>Int32Type</Name>
					<Type>int</Type>
					<ColumnName>Int32Type</ColumnName>
					<Description>Description for Int32Type</Description>
				</Param>
				<Param>
					<Name>Int64Type</Name>
					<Type>long</Type>
					<ColumnName>Int64Type</ColumnName>
					<Description>Description for Int64Type</Description>
				</Param>
				<Param>
					<Name>FloatType</Name>
					<Type>float</Type>
					<ColumnName>FloatType</ColumnName>
					<Description>Description for FloatType</Description>
				</Param>
				<Param>
					<Name>DoubleType</Name>
					<Type>double</Type>
					<ColumnName>DoubleType</ColumnName>
					<Description>Description for DoubleType</Description>
				</Param>
				<Param>
					<Name>BooleanType</Name>
					<Type>boolean</Type>
					<ColumnName>BooleanType</ColumnName>
					<Description>Description for BooleanType</Description>
				</Param>
				<Param>
					<Name>DateType</Name>
					<Type>date</Type>
					<ColumnName>DateType</ColumnName>
					<Description>Description for DateType</Description>
				</Param>
			</Params>
		</AuditEvent>
		<AuditEvent>
			<TypeId>TestEvent2</TypeId>
			<CategoryId>TestCategory2</CategoryId>
			<Params>
				<Param>
					<Name>StringType2</Name>
					<Type>string</Type>
					<ColumnName>StringType2</ColumnName>
					<Description>Description for StringType2</Description>
				</Param>
				<Param>
					<Name>Int16Type2</Name>
					<Type>short</Type>
					<ColumnName>Int16Type2</ColumnName>
					<Description>Description for Int16Type2</Description>
				</Param>
			</Params>
		</AuditEvent>
		<AuditEvent>
			<TypeId>TestEvent3</TypeId>
			<CategoryId>TestCategory3</CategoryId>
			<Params>
				<Param>
					<Name>StringType3</Name>
					<Type>string</Type>
					<ColumnName>StringType3</ColumnName>
					<Description>Description for StringType3</Description>
				</Param>
				<Param>
					<Name>DateType2</Name>
					<Type>date</Type>
					<ColumnName>DateType2</ColumnName>
					<Description>Description for DateType2</Description>
				</Param>
			</Params>
		</AuditEvent>
	</AuditEvents>
</AuditedApplication>
